title,price,availability,rating
If I Gave You God's Phone Number....: Searching for Spirituality in America,£20.91,In,One
"Fruits Basket, Vol. 9 (Fruits Basket #9)",£33.95,In,Four
Dress Your Family in Corduroy and Denim,£43.68,In,Three
Don't Forget Steven,£33.23,In,One
Chernobyl 01:23:40: The Incredible True Story of the World's Worst Nuclear Disaster,£35.92,In,Two
Art and Fear: Observations on the Perils (and Rewards) of Artmaking,£48.63,In,Four
A Shard of Ice (The Black Symphony Saga #1),£56.63,In,Three
A Hero's Curse (The Unseen Chronicles #1),£50.49,In,Three
23 Degrees South: A Tropical Tale of Changing Whether...,£35.79,In,Two
"Zero to One: Notes on Startups, or How to Build the Future",£34.06,In,Three
Why Not Me?,£17.76,In,One
When Breath Becomes Air,£39.36,In,Two
Vagabonding: An Uncommon Guide to the Art of Long-Term World Travel,£36.94,In,Two
The Unlikely Pilgrimage of Harold Fry (Harold Fry #1),£43.62,In,Five
The New Drawing on the Right Side of the Brain,£43.02,In,Three
"The Midnight Assassin: Panic, Scandal, and the Hunt for America's First Serial Killer",£28.45,In,Four
The Martian (The Martian #1),£41.39,In,Two
The High Mountains of Portugal,£51.15,In,One
The Grownup,£35.88,In,One
The E-Myth Revisited: Why Most Small Businesses Don't Work and What to Do About It,£36.91,In,One
South of Sunshine,£28.93,In,One
Smarter Faster Better: The Secrets of Being Productive in Life and Business,£38.89,In,Five
Silence in the Dark (Logan Point #4),£58.33,In,Three
Shadows of the Past (Logan Point #1),£39.67,In,Five
Roller Girl,£14.10,In,Five
Rising Strong,£21.82,In,Three
Proofs of God: Classical Arguments from Tertullian to Barth,£54.21,In,One
Please Kill Me: The Uncensored Oral History of Punk,£31.19,In,Four
Out of Print: City Lights Spotlight No. 14,£53.64,In,Five
My Life Next Door (My Life Next Door ),£36.39,In,Five
Miller's Valley,£58.54,In,Two
Man's Search for Meaning,£29.48,In,Three
"Love That Boy: What Two Presidents, Eight Road Trips, and My Son Taught Me About a Parent's Expectations",£25.06,In,Two
Living Forward: A Proven Plan to Stop Drifting and Get the Life You Want,£12.55,In,Three
Les Fleurs du Mal,£29.04,In,Five
Left Behind (Left Behind #1),£40.72,In,Two
Kill 'Em and Leave: Searching for James Brown and the American Soul,£45.05,In,Five
Kierkegaard: A Christian Missionary to Christians,£47.13,In,One
John Vassos: Industrial Design for Modern Life,£20.22,In,Four
I'll Give You the Sun,£56.48,In,One
I Will Find You,£44.21,In,One
Hystopia: A Novel,£21.96,In,Four
Howl and Other Poems,£40.45,In,Two
History of Beauty,£10.29,In,Four
Heaven is for Real: A Little Boy's Astounding Story of His Trip to Heaven and Back,£52.86,In,Two
Future Shock (Future Shock #1),£55.65,In,Five
Ender's Game (The Ender Quintet #1),£43.64,In,One
Diary of a Citizen Scientist: Chasing Tiger Beetles and Other New Ways of Engaging the World,£28.41,In,One
Death by Leisure: A Cautionary Tale,£37.51,In,Four
Brilliant Beacons: A History of the American Lighthouse,£11.45,In,Three
Brazen: The Courage to Find the You That's Been Hiding,£19.22,In,Two
Between the World and Me,£56.91,In,Four
Being Mortal: Medicine and What Matters in the End,£55.06,In,Four
"A Murder Over a Girl: Justice, Gender, Junior High",£13.20,In,Three
32 Yolks,£53.63,In,Two
"""Most Blessed of the Patriarchs"": Thomas Jefferson and the Empire of the Imagination",£44.48,In,Five
You Are a Badass: How to Stop Doubting Your Greatness and Start Living an Awesome Life,£12.08,In,Three
Wildlife of New York: A Five-Borough Coloring Book,£22.14,In,Two
What Happened on Beale Street (Secrets of the South Mysteries #2),£25.37,In,Five
Unreasonable Hope: Finding Faith in the God Who Brings Purpose to Your Pain,£46.33,In,Two
Under the Tuscan Sun,£37.33,In,Three
Toddlers Are A**holes: It's Not Your Fault,£25.55,In,One
The Year of Living Biblically: One Man's Humble Quest to Follow the Bible as Literally as Possible,£34.72,In,One
The Whale,£35.96,In,Four
The Story of Art,£41.14,In,Four
The Origin of Species,£10.01,In,Four
The Great Gatsby,£36.05,In,Four
The Good Girl,£49.03,In,Three
The Glass Castle,£16.24,In,One
The Faith of Christopher Hitchens: The Restless Soul of the World's Most Notorious Atheist,£39.55,In,One
The Drowning Girls,£35.67,In,Three
The Constant Princess (The Tudor Court #1),£16.62,In,Three
The Bourne Identity (Jason Bourne #1),£42.78,In,Four
The Bachelor Girl's Guide to Murder (Herringford and Watts Mysteries #1),£52.30,In,Five
The Art Book,£32.34,In,Two
The 7 Habits of Highly Effective People: Powerful Lessons in Personal Change,£33.17,In,Four
Team of Rivals: The Political Genius of Abraham Lincoln,£20.12,In,Five
Steal Like an Artist: 10 Things Nobody Told You About Being Creative,£20.90,In,Two
"Sit, Stay, Love",£20.90,In,Three
Sister Dear,£40.20,In,Four
"Shrunken Treasures: Literary Classics, Short, Sweet, and Silly",£52.87,In,Three
"Rich Dad, Poor Dad",£51.74,In,One
Raymie Nightingale,£34.41,In,Two
Playing from the Heart,£32.38,In,One
Nightstruck: A Novel,£50.35,In,Four
"Naturally Lean: 125 Nourishing Gluten-Free, Plant-Based Recipes--All Under 300 Calories",£11.38,In,Five
Meternity,£43.58,In,Three
Memoirs of a Geisha,£49.67,In,Three
Like Never Before (Walker Family #2),£28.77,In,Two
Life of Pi,£13.22,In,Four
Leave This Song Behind: Teen Poetry at Its Best,£51.17,In,Five
King's Folly (The Kinsman Chronicles #1),£39.61,In,Five
John Adams,£57.43,In,Four
How to Cook Everything Vegetarian: Simple Meatless Recipes for Great Food (How to Cook Everything),£46.01,In,Four
How to Be a Domestic Goddess: Baking and the Art of Comfort Cooking,£28.25,In,Two
Good in Bed (Cannie Shapiro #1),£37.05,In,Five
"Fruits Basket, Vol. 7 (Fruits Basket #7)",£19.57,In,One
For the Love: Fighting for Grace in a World of Impossible Standards,£45.13,In,Three
Finding God in the Ruins: How God Redeems Pain,£46.64,In,Two
Every Heart a Doorway (Every Heart A Doorway #1),£12.16,In,Five
Delivering the Truth (Quaker Midwife Mystery #1),£20.89,In,Four
Counted With the Stars (Out from Egypt #1),£17.97,In,Five
"Chronicles, Vol. 1",£52.60,In,Two
Blue Like Jazz: Nonreligious Thoughts on Christian Spirituality,£25.77,In,One
Benjamin Franklin: An American Life,£48.19,In,Three
"At The Existentialist Café: Freedom, Being, and apricot cocktails with: Jean-Paul Sartre, Simone de Beauvoir, Albert Camus, Martin Heidegger, Edmund Husserl, Karl Jaspers, Maurice Merleau-Ponty and others",£29.93,In,Five
A Summer In Europe,£44.34,In,Two
A Short History of Nearly Everything,£52.40,In,Five
A Gathering of Shadows (Shades of Magic #2),£44.81,In,Four
The Sound Of Love,£57.84,In,Five
The Rise and Fall of the Third Reich: A History of Nazi Germany,£39.67,In,Two
The Perks of Being a Wallflower,£55.02,In,Three
The Mysterious Affair at Styles (Hercule Poirot #1),£24.80,In,Four
The Man Who Mistook His Wife for a Hat and Other Clinical Tales,£59.45,In,Four
The Makings of a Fatherless Child,£31.58,In,Two
The Joy of Cooking,£43.27,In,Four
The Invention of Wings,£37.34,In,One
The Hobbit (Middle-Earth Universe),£17.80,In,Five
The Great Railway Bazaar,£30.54,In,One
The Golden Compass (His Dark Materials #1),£18.77,In,One
The God Delusion,£46.85,In,Three
The Girl You Left Behind (The Girl You Left Behind #1),£15.79,In,One
The Fellowship of the Ring (The Lord of the Rings #1),£10.27,In,Two
The Collected Poems of W.B. Yeats (The Collected Works of W.B. Yeats #1),£15.42,In,Five
The Barefoot Contessa Cookbook,£59.92,In,Five
Tell the Wolves I'm Home,£50.96,In,Two
Ship Leaves Harbor: Essays on Travel by a Recovering Journeyman,£30.60,In,Three
Pride and Prejudice,£19.27,In,Four
Musicophilia: Tales of Music and the Brain,£46.58,In,One
Mere Christianity,£48.51,In,Three
Me Before You (Me Before You #1),£19.02,In,One
In the Woods (Dublin Murder Squad #1),£38.38,In,Two
In Cold Blood,£49.98,In,Four
How to Stop Worrying and Start Living,£46.49,In,Five
Give It Back,£18.32,In,Two
"Girl, Interrupted",£42.14,In,Three
Fun Home: A Family Tragicomic,£56.59,In,Four
"Fruits Basket, Vol. 6 (Fruits Basket #6)",£20.96,In,Four
Deception Point,£40.32,In,Four
"Death Note, Vol. 6: Give-and-Take (Death Note #6)",£36.39,In,Three
Catherine the Great: Portrait of a Woman,£58.55,In,Four
Better Homes and Gardens New Cook Book,£39.61,In,Three
An Unquiet Mind: A Memoir of Moods and Madness,£21.30,In,Three
A Year in Provence (Provence #1),£56.88,In,Four
World Without End (The Pillars of the Earth #2),£32.97,In,Four
"Will Grayson, Will Grayson (Will Grayson, Will Grayson)",£47.31,In,Four
Why Save the Bankers?: And Other Essays on Our Economic and Political Crisis,£48.67,In,Two
Where She Went (If I Stay #2),£41.73,In,Four
What If?: Serious Scientific Answers to Absurd Hypothetical Questions,£53.68,In,Four
Two Summers,£14.64,In,One
This Is Your Brain on Music: The Science of a Human Obsession,£38.40,In,One
The Secret Garden,£15.08,In,Four
The Raven King (The Raven Cycle #4),£30.57,In,Two
The Raven Boys (The Raven Cycle #1),£57.74,In,Four
The Power Greens Cookbook: 140 Delicious Superfood Recipes,£11.05,In,Five
The Metamorphosis,£28.58,In,One
The Mathews Men: Seven Brothers and the War Against Hitler's U-boats,£42.91,In,Five
The Little Paris Bookshop,£24.73,In,Three
The Hiding Place,£55.91,In,Four
The Grand Design,£13.76,In,Three
The Firm,£45.56,In,Three
The Fault in Our Stars,£47.22,In,One
The False Prince (The Ascendance Trilogy #1),£56.00,In,Five
The Expatriates,£44.58,In,Two
The Dream Thieves (The Raven Cycle #2),£34.50,In,One
The Darkest Corners,£11.33,In,Five
The Crossover,£38.77,In,Four
The 5th Wave (The 5th Wave #1),£11.83,In,Two
Tell the Wind and Fire,£45.51,In,Three
Tell Me Three Things,£41.81,In,One
Talking to Girls About Duran Duran: One Young Man's Quest for True Love and a Cooler Haircut,£25.15,In,Four
Siddhartha,£34.22,In,Five
Shiver (The Wolves of Mercy Falls #1),£16.23,In,Five
Remember Me?,£11.48,In,Three
Red Dragon (Hannibal Lecter #1),£23.37,In,Three
Peak: Secrets from the New Science of Expertise,£16.28,In,Two
My Mother Was Nuts,£31.63,In,Four
Mexican Today: New and Rediscovered Recipes for Contemporary Kitchens,£24.91,In,Five
Maybe Something Beautiful: How Art Transformed a Neighborhood,£22.54,In,One
Lola and the Boy Next Door (Anna and the French Kiss #2),£23.63,In,Four
Logan Kade (Fallen Crest High #5.5),£13.12,In,Two
Last One Home (New Beginnings #1),£59.98,In,Three
Killing Floor (Jack Reacher #1),£31.49,In,Four
Kill the Boy Band,£15.52,In,Five
Isla and the Happily Ever After (Anna and the French Kiss #3),£48.13,In,Five
If I Stay (If I Stay #1),£38.13,In,Five
I Know Why the Caged Bird Sings (Maya Angelou's Autobiography #1),£36.55,In,Two
Harry Potter and the Deathly Hallows (Harry Potter #7),£23.32,In,One
"Fruits Basket, Vol. 5 (Fruits Basket #5)",£16.33,In,One
Foundation (Foundation (Publication Order) #1),£32.42,In,One
Fool Me Once,£16.96,In,One
Find Her (Detective D.D. Warren #8),£22.37,In,One
Evicted: Poverty and Profit in the American City,£42.27,In,One
Drama,£38.70,In,Two
Dracula the Un-Dead,£35.63,In,Five
Digital Fortress,£58.00,In,Five
"Death Note, Vol. 5: Whiteout (Death Note #5)",£52.41,In,One
"Data, A Love Story: How I Gamed Online Dating to Meet My Match",£32.35,In,Three
Critique of Pure Reason,£20.75,In,One
Booked,£17.49,In,Five
"Blue Lily, Lily Blue (The Raven Cycle #3)",£34.13,In,Five
Approval Junkie: Adventures in Caring Too Much,£58.81,In,Five
An Abundance of Katherines,£10.00,In,Five
America's War for the Greater Middle East: A Military History,£51.22,In,Two
Alight (The Generations Trilogy #2),£58.59,In,Four
A Girl's Guide to Moving On (New Beginnings #2),£31.30,In,One
A Game of Thrones (A Song of Ice and Fire #1),£46.42,In,Two
A Feast for Crows (A Song of Ice and Fire #4),£17.21,In,Four
A Clash of Kings (A Song of Ice and Fire #2),£10.79,In,Three
Vogue Colors A to Z: A Fashion Coloring Book,£52.35,In,Four
The Shining (The Shining #1),£27.88,In,Three
The Pilgrim's Progress,£50.26,In,Two
The Perfect Play (Play by Play #1),£59.99,In,Three
The Passion of Dolssa,£28.32,In,Five
The Jazz of Physics: The Secret Link Between Music and the Structure of the Universe,£38.71,In,Three
The Hunger Games (The Hunger Games #1),£29.85,In,Five
The Hound of the Baskervilles (Sherlock Holmes #5),£14.82,In,Two
The Gunning of America: Business and the Making of American Gun Culture,£16.81,In,Four
The Geography of Bliss: One Grump's Search for the Happiest Places in the World,£28.23,In,Two
The Demonists (Demonist #1),£52.11,In,Two
"The Demon Prince of Momochi House, Vol. 4 (The Demon Prince of Momochi House #4)",£27.88,In,Two
The Bone Hunters (Lexy Vaughan & Steven Macaulay #2),£59.71,In,Three
The Beast (Black Dagger Brotherhood #14),£46.08,In,Five
Some Women,£13.73,In,Five
Shopaholic Ties the Knot (Shopaholic #3),£48.39,In,Five
Paper and Fire (The Great Library #2),£49.45,In,Five
Outlander (Outlander #1),£19.67,In,Five
"Orchestra of Exiles: The Story of Bronislaw Huberman, the Israel Philharmonic, and the One Thousand Jews He Saved from Nazi Horrors",£12.36,In,Three
No One Here Gets Out Alive,£20.02,In,Five
Night Shift (Night Shift #1-20),£12.75,In,Four
Needful Things,£47.51,In,Four
Mockingjay (The Hunger Games #3),£20.44,In,Four
Misery,£34.79,In,Two
Little Women (Little Women #1),£28.07,In,Four
It,£25.01,In,Three
Harry Potter and the Sorcerer's Stone (Harry Potter #1),£13.90,In,Three
Harry Potter and the Prisoner of Azkaban (Harry Potter #3),£24.17,In,Four
Harry Potter and the Order of the Phoenix (Harry Potter #5),£31.63,In,Four
Harry Potter and the Half-Blood Prince (Harry Potter #6),£48.75,In,Five
Harry Potter and the Chamber of Secrets (Harry Potter #2),£14.74,In,One
Gone with the Wind,£32.49,In,Three
God Is Not Great: How Religion Poisons Everything,£27.80,In,One
Girl With a Pearl Earring,£26.77,In,One
"Fruits Basket, Vol. 4 (Fruits Basket #4)",£50.44,In,Four
Far From True (Promise Falls Trilogy #2),£34.93,In,Two
Dark Lover (Black Dagger Brotherhood #1),£12.87,In,One
Confessions of a Shopaholic (Shopaholic #1),£48.94,In,Two
Changing the Game (Play by Play #2),£13.38,In,Three
Candide,£58.63,In,Three
Can You Keep a Secret?,£21.94,In,One
Atlas Shrugged,£26.58,In,Five
Animal Farm,£57.22,In,Three
A Walk to Remember,£56.43,In,One
A New Earth: Awakening to Your Life's Purpose,£55.65,In,Five
"A History of God: The 4,000-Year Quest of Judaism, Christianity, and Islam",£27.62,In,One
'Salem's Lot,£49.56,In,Four
Zero History (Blue Ant #3),£34.77,In,One
Wuthering Heights,£17.73,In,Three
World War Z: An Oral History of the Zombie War,£21.80,In,One
Wild: From Lost to Found on the Pacific Crest Trail,£46.02,In,Three
"Where'd You Go, Bernadette",£18.13,In,One
When You Are Engulfed in Flames,£30.89,In,Five
We the People: The Modern-Day Figures Who Have Reshaped and Affirmed the Founding Fathers' Vision of America,£31.95,In,Three
We Are All Completely Beside Ourselves,£24.04,In,One
Walk the Edge (Thunder Road #2),£32.36,In,Three
Voyager (Outlander #3),£21.07,In,Five
Very Good Lives: The Fringe Benefits of Failure and the Importance of Imagination,£50.66,In,Three
Vegan Vegetarian Omnivore: Dinner for Everyone at the Table,£13.66,In,Two
"Unstuffed: Decluttering Your Home, Mind, and Soul",£58.09,In,One
Under the Banner of Heaven: A Story of Violent Faith,£30.00,In,One
Two Boys Kissing,£32.74,In,Two
Twilight (Twilight #1),£41.93,In,Two
Twenties Girl,£42.80,In,Two
"Trespassing Across America: One Man's Epic, Never-Done-Before (and Sort of Illegal) Hike Across the Heartland",£53.51,In,One
Three-Martini Lunch,£23.21,In,Three
"Thinking, Fast and Slow",£21.14,In,One
The Wild Robot,£56.07,In,Three
"The Wicked + The Divine, Vol. 3: Commercial Suicide (The Wicked + The Divine)",£14.41,In,Three
The Undomestic Goddess,£45.75,In,Four
The Travelers,£15.77,In,One
The Tipping Point: How Little Things Can Make a Big Difference,£10.02,In,Two
The Thing About Jellyfish,£48.77,In,One
The Stand,£57.86,In,Two
The Smitten Kitchen Cookbook,£23.59,In,One
The Silkworm (Cormoran Strike #2),£23.05,In,Five
"The Sandman, Vol. 3: Dream Country (The Sandman (volumes) #3)",£55.55,In,Five
The Rose & the Dagger (The Wrath and the Dawn #2),£58.64,In,Four
The Road to Little Dribbling: Adventures of an American in Britain (Notes From a Small Island #2),£23.21,In,One
The Rise of Theodore Roosevelt (Theodore Roosevelt #1),£42.57,In,Three
The Restaurant at the End of the Universe (Hitchhiker's Guide to the Galaxy #2),£10.92,In,One
The Rest Is Noise: Listening to the Twentieth Century,£34.77,In,One
The Red Tent,£35.66,In,Five
The Purpose Driven Life: What on Earth Am I Here for?,£37.19,In,Three
The Purest Hook (Second Circle Tattoos #3),£12.25,In,One
The Picture of Dorian Gray,£29.70,In,Two
The Paris Wife,£36.80,In,Three
The Obsession,£45.43,In,One
The Nightingale,£26.26,In,Four
The New Guy (and Other Senior Year Distractions),£44.92,In,Three
The Nanny Diaries (Nanny #1),£52.53,In,Five
The Name of God is Mercy,£37.25,In,Two
The Maze Runner (The Maze Runner #1),£20.93,In,One
The Lover's Dictionary,£58.09,In,Two
The Lonely Ones,£43.59,In,Five
The Lean Startup: How Today's Entrepreneurs Use Continuous Innovation to Create Radically Successful Businesses,£33.92,In,Three
The Last Painting of Sara de Vos,£55.55,In,Two
"The Land of 10,000 Madonnas",£29.64,In,Four
The Infinities,£27.41,In,One
The Husband's Secret,£52.51,In,Five
The Hitchhiker's Guide to the Galaxy (Hitchhiker's Guide to the Galaxy #1),£47.80,In,Three
The Guns of August,£14.54,In,Two
The Guernsey Literary and Potato Peel Pie Society,£49.53,In,One
The Goldfinch,£43.58,In,Three
The Giver (The Giver Quartet #1),£12.30,In,One
The Girl with All the Gifts,£49.47,In,Three
The Girl Who Played with Fire (Millennium Trilogy #2),£22.14,In,Two
The Girl Who Kicked the Hornet's Nest (Millennium Trilogy #3),£57.48,In,One
The Exiled,£43.45,In,Three
"The End of Faith: Religion, Terror, and the Future of Reason",£22.13,In,Four
"The Elegant Universe: Superstrings, Hidden Dimensions, and the Quest for the Ultimate Theory",£13.03,In,Four
"The Disappearing Spoon: And Other True Tales of Madness, Love, and the History of the World from the Periodic Table of the Elements",£57.35,In,Five
The Devil Wears Prada (The Devil Wears Prada #1),£44.29,In,One
The Demon-Haunted World: Science as a Candle in the Dark,£52.25,In,Four
The Day the Crayons Came Home (Crayons),£26.33,In,Five
The Da Vinci Code (Robert Langdon #2),£22.96,In,Two
The Cuckoo's Calling (Cormoran Strike #1),£19.21,In,One
The Complete Stories and Poems (The Works of Edgar Allan Poe [Cameo Edition]),£26.78,In,Four
The Complete Poems,£41.32,In,Five
The Catcher in the Rye,£24.55,In,One
The Cat in the Hat (Beginner Books B-1),£16.26,In,Two
The Case for Christ (Cases for Christianity),£47.84,In,One
The Book Thief,£53.49,In,Two
The Book of Basketball: The NBA According to The Sports Guy,£44.84,In,Five
The Blind Side: Evolution of a Game,£53.71,In,Five
The Autobiography of Malcolm X,£23.43,In,Two
"The Art of Simple Food: Notes, Lessons, and Recipes from a Delicious Revolution",£34.32,In,Three
The Art of Fielding,£22.10,In,One
"Surely You're Joking, Mr. Feynman!: Adventures of a Curious Character",£25.83,In,Two
Stiff: The Curious Lives of Human Cadavers,£36.74,In,Three
Spilled Milk: Based on a True Story,£49.51,In,One
Something Borrowed (Darcy & Rachel #1),£48.96,In,Five
Something Blue (Darcy & Rachel #2),£54.62,In,One
Soldier (Talon #3),£24.72,In,Two
Shopaholic & Baby (Shopaholic #5),£46.45,In,Two
Seven Days in the Art World,£52.33,In,Two
Seven Brief Lessons on Physics,£30.60,In,Four
Scarlet (The Lunar Chronicles #2),£14.57,In,Four
Sarah's Key,£46.29,In,One
"Saga, Volume 3 (Saga (Collected Editions) #3)",£21.57,In,Five
Running with Scissors,£12.91,In,Four
Rogue Lawyer (Rogue Lawyer #1),£50.11,In,Three
"Rise of the Rocket Girls: The Women Who Propelled Us, from Missiles to the Moon to Mars",£41.67,In,Four
Rework,£44.88,In,Two
Reservations for Two,£11.10,In,Three
Red: The True Story of Red Riding Hood,£28.54,In,Three
Ready Player One,£19.07,In,Four
Quiet: The Power of Introverts in a World That Can't Stop Talking,£43.55,In,One
Prodigy: The Graphic Novel (Legend: The Graphic Novel #2),£43.63,In,Three
Persepolis: The Story of a Childhood (Persepolis #1-2),£39.13,In,One
Packing for Mars: The Curious Science of Life in the Void,£56.68,In,Two
Outliers: The Story of Success,£14.16,In,One
Original Fake,£31.45,In,Three
Orange Is the New Black,£24.61,In,Two
One for the Money (Stephanie Plum #1),£32.87,In,Two
Notes from a Small Island (Notes From a Small Island #1),£40.17,In,One
Night (The Night Trilogy #1),£13.51,In,One
Neither Here nor There: Travels in Europe,£38.95,In,Three
Naked,£31.69,In,Three
Morning Star (Red Rising #3),£29.40,In,One
"Miracles from Heaven: A Little Girl, Her Journey to Heaven, and Her Amazing Story of Healing",£57.83,In,One
Midnight Riot (Peter Grant/ Rivers of London - books #1),£55.46,In,Two
Me Talk Pretty One Day,£57.60,In,Two
Manuscript Found in Accra,£34.98,In,Two
Lust & Wonder,£11.87,In,Two
Lila (Gilead #3),£12.47,In,Three
"Life, the Universe and Everything (Hitchhiker's Guide to the Galaxy #3)",£33.26,In,Two
Life Without a Recipe,£59.04,In,Five
Life After Life,£26.13,In,Two
Letter to a Christian Nation,£22.20,In,One
Let's Pretend This Never Happened: A Mostly True Memoir,£45.11,In,One
Legend (Legend #1),£43.69,In,Four
"Lean In: Women, Work, and the Will to Lead",£25.02,In,One
"Lamb: The Gospel According to Biff, Christ's Childhood Pal",£55.50,In,Five
Lady Renegades (Rebel Belle #3),£53.04,In,Five
Jurassic Park (Jurassic Park #1),£44.97,In,One
It's Never Too Late to Begin Again: Discovering Creativity and Meaning at Midlife and Beyond,£42.38,In,One
Is Everyone Hanging Out Without Me? (And Other Concerns),£20.11,In,Three
Into the Wild,£56.70,In,Five
Inferno (Robert Langdon #4),£41.00,In,Five
"In the Garden of Beasts: Love, Terror, and an American Family in Hitler's Berlin",£28.85,In,Three
If I Run (If I Run #1),£49.97,In,Four
I've Got Your Number,£19.69,In,One
I Am Malala: The Girl Who Stood Up for Education and Was Shot by the Taliban,£28.88,In,Two
Hungry Girl Clean & Hungry: Easy All-Natural Recipes for Healthy Eating in the Real World,£33.14,In,Three
"House of Lost Worlds: Dinosaurs, Dynasties, and the Story of Life on Earth",£43.70,In,Two
House of Leaves,£54.89,In,One
Horrible Bear!,£37.52,In,Two
Holidays on Ice,£51.07,In,Two
Heir to the Sky,£44.07,In,Four
Green Eggs and Ham (Beginner Books B-16),£10.79,In,Four
"Grayson, Vol 3: Nemesis (Grayson #3)",£42.72,In,One
Gratitude,£26.66,In,Five
Gone Girl,£37.60,In,Five
Golden (Heart of Dread #3),£42.21,In,Four
Girl in the Blue Coat,£46.83,In,Two
"Fruits Basket, Vol. 3 (Fruits Basket #3)",£45.17,In,Two
"Friday Night Lights: A Town, a Team, and a Dream",£51.22,In,Three
Fire Bound (Sea Haven/Sisters of the Heart #5),£21.28,In,Four
Fifty Shades Freed (Fifty Shades #3),£15.36,In,Five
Fellside,£38.62,In,One
Extreme Prey (Lucas Davenport #26),£25.40,In,Three
Eragon (The Inheritance Cycle #1),£43.87,In,Three
Eclipse (Twilight #3),£18.74,In,One
Dune (Dune #1),£54.86,In,One
Dracula,£52.62,In,Three
Do Androids Dream of Electric Sheep? (Blade Runner #1),£51.48,In,One
Disrupted: My Misadventure in the Start-Up Bubble,£15.28,In,Five
Dead Wake: The Last Crossing of the Lusitania,£39.24,In,Five
"David and Goliath: Underdogs, Misfits, and the Art of Battling Giants",£17.81,In,One
Darkfever (Fever #1),£56.02,In,One
Dark Places,£23.90,In,Five
Crazy Rich Asians (Crazy Rich Asians #1),£49.13,In,Five
Counting Thyme,£10.62,In,One
Cosmos,£36.17,In,Two
Civilization and Its Discontents,£59.95,In,Two
Cinder (The Lunar Chronicles #1),£26.09,In,One
Catastrophic Happiness: Finding Joy in Childhood's Messy Years,£37.35,In,Two
Career of Evil (Cormoran Strike #3),£24.72,In,Two
Breaking Dawn (Twilight #4),£35.28,In,Five
Brave Enough,£51.32,In,Five
Boy Meets Boy,£21.12,In,Three
"Born to Run: A Hidden Tribe, Superathletes, and the Greatest Race the World Has Never Seen",£27.35,In,Two
Blink: The Power of Thinking Without Thinking,£21.74,In,Five
Black Flags: The Rise of ISIS,£40.87,In,One
"Black Butler, Vol. 1 (Black Butler #1)",£49.31,In,One
Big Little Lies,£22.11,In,One
Between Shades of Gray,£20.79,In,Five
Best of My Love (Fool's Gold #20),£27.41,In,Two
Beowulf,£38.35,In,Two
Beautiful Creatures (Caster Chronicles #1),£21.55,In,Five
Awkward,£38.02,In,Two
Ash,£22.06,In,Four
Are We There Yet?,£10.66,In,Three
Are We Smart Enough to Know How Smart Animals Are?,£56.58,In,One
Annie on My Mind,£36.83,In,Five
And Then There Were None,£35.01,In,Two
A Walk in the Woods: Rediscovering America on the Appalachian Trail,£30.48,In,Four
A Visit from the Goon Squad,£14.08,In,Five
A Storm of Swords (A Song of Ice and Fire #3),£31.22,In,Two
A Heartbreaking Work of Staggering Genius,£54.29,In,Five
8 Keys to Mental Health Through Exercise,£31.04,In,One
#GIRLBOSS,£50.96,In,One
"The Suffragettes (Little Black Classics, #96)",£11.89,In,Two
The Sense of an Ending,£31.38,In,Three
"The Sandman, Vol. 2: The Doll's House (The Sandman (volumes) #2)",£54.81,In,One
The Course of Love,£16.78,In,Three
Sugar Rush (Offensive Line #2),£24.42,In,One
"Saga, Volume 2 (Saga (Collected Editions) #2)",£11.75,In,Three
